{
  "agency": {
    "full_name": "○○部",
    "unit": "綜合規劃司",
    "short_name": "本部",
    "head_title": "部長"
  },
  "traveler": {
    "name": "王示範",
    "title": "科員",
    "rank": "薦任第七職等"
  },
  "trip": {
    "purpose_category": "開會",
    "country": "泰國",
    "city": "曼谷",
    "start_date": "2027-09-01",
    "end_date": "2027-09-05",
    "organization": "示範國際組織"
  },
  "summary": "本次出國係奉派赴泰國曼谷，出席示範國際組織第二十三屆年度業務協調會議，出訪期間為二○二七年九月一日至九月五日，共五日。會議主要議題聚焦於跨部門資料互通標準之修訂及未來三年合作框架之討論，各成員國就資料交換格式、隱私保護機制及跨境協作流程等面向廣泛交換意見。本部代表依會前準備資料，就我國現行實施進度及政策推動情形提出報告，獲與會代表正面回應。本次參與收穫豐碩，返國後將參考各成員國分享之最佳實務，研提具體政策建言，提送長官核閱後移送相關業務單位研處。",
  "itinerary": [
    {
      "date": "2027-09-01",
      "label": "第一日・出發抵達",
      "items": [
        {
          "time": "07:30",
          "activity": "桃園國際機場集合，辦理報到及行李托運",
          "location": "桃園國際機場第二航廈",
          "note": "請攜帶護照正本、電子機票及出差核准文件"
        },
        {
          "time": "09:45",
          "activity": "搭乘示範航空 XX901 班機出發",
          "location": "桃園國際機場"
        },
        {
          "time": "12:15",
          "activity": "抵達蘇凡納布米國際機場，辦理入境",
          "location": "曼谷蘇凡納布米國際機場",
          "note": "泰國時間較台灣慢 1 小時"
        },
        {
          "time": "15:00",
          "activity": "抵達住宿飯店，辦理入住手續",
          "location": "示範大飯店（曼谷市區）"
        },
        {
          "time": "晚間",
          "activity": "與示範國際組織秘書處人員進行非正式晚餐交流",
          "location": "飯店附近指定餐廳"
        }
      ]
    },
    {
      "date": "2027-09-02",
      "label": "第二日・正式會議（上下午全日）",
      "items": [
        {
          "time": "08:30",
          "activity": "報到及領取大會資料",
          "location": "示範國際組織會議中心大廳"
        },
        {
          "time": "09:00",
          "activity": "開幕式暨主席致詞",
          "location": "會議中心主會場"
        },
        {
          "time": "09:30",
          "activity": "議題一：跨部門資料互通標準修訂草案說明",
          "location": "會議中心主會場"
        },
        {
          "time": "11:00",
          "activity": "議題二：各成員國現況報告（含本部代表發言）",
          "location": "會議中心主會場",
          "note": "本部代表發言順序為第三位，請提前備妥簡報檔"
        },
        {
          "time": "12:00",
          "activity": "午餐（大會安排，連絡人：大會秘書林示範）",
          "location": "會議中心二樓餐廳"
        },
        {
          "time": "13:30",
          "activity": "議題三：未來三年合作框架討論",
          "location": "會議中心主會場"
        },
        {
          "time": "15:30",
          "activity": "議題四：隱私保護機制及跨境協作流程",
          "location": "會議中心主會場"
        },
        {
          "time": "17:00",
          "activity": "第一日會議結束，返回飯店",
          "location": "示範大飯店"
        }
      ]
    },
    {
      "date": "2027-09-03",
      "label": "第三日・分組討論與雙邊會談",
      "items": [
        {
          "time": "09:00",
          "activity": "分組工作坊：資料交換格式技術規範討論",
          "location": "會議中心 B2 會議室",
          "note": "本部代表出席 Group C（亞太區）"
        },
        {
          "time": "12:00",
          "activity": "午餐（自理）",
          "location": "自行安排"
        },
        {
          "time": "14:00",
          "activity": "雙邊會談：與示範友邦代表交流我國政策推動經驗",
          "location": "會議中心 VIP 會議室"
        },
        {
          "time": "16:00",
          "activity": "大會閉幕式暨聯合聲明發布",
          "location": "會議中心主會場"
        },
        {
          "time": "晚間",
          "activity": "大會歡送晚宴",
          "location": "曼谷指定宴會場地"
        }
      ]
    },
    {
      "date": "2027-09-04",
      "label": "第四日・考察參訪",
      "items": [
        {
          "time": "上午",
          "activity": "參訪示範國際組織資料中心",
          "location": "曼谷科技園區",
          "note": "請攜帶名片，參訪後撰寫考察紀要"
        },
        {
          "time": "下午",
          "activity": "自由活動或備辦採購公務所需資料",
          "location": "自行安排"
        }
      ]
    },
    {
      "date": "2027-09-05",
      "label": "第五日・返國",
      "items": [
        {
          "time": "06:00",
          "activity": "飯店退房，前往機場",
          "location": "示範大飯店 → 蘇凡納布米機場",
          "note": "建議提前 3 小時抵達機場"
        },
        {
          "time": "09:15",
          "activity": "搭乘示範航空 XX902 班機返台",
          "location": "蘇凡納布米國際機場"
        },
        {
          "time": "13:45",
          "activity": "抵達桃園國際機場，入境後直接返回工作崗位",
          "location": "桃園國際機場第二航廈"
        }
      ]
    }
  ],
  "lodging": [
    {
      "name": "示範大飯店 Demo Grand Hotel",
      "address": "123 Sathon Road, Bangkok 10120, Thailand",
      "phone": "+66-2-555-1234",
      "check_in": "2027-09-01",
      "check_out": "2027-09-05",
      "note": "訂房確認碼：DGH-2027-0901。如需開立統一發票，請提前告知前台。"
    }
  ],
  "emergency_contacts": [
    {
      "label": "駐外館處",
      "name": "我國駐當地代表處緊急服務專線（範例）",
      "phone": "+66-2-000-1111",
      "note": "24 小時緊急協助。辦公時間 09:00–17:30（當地時間）；實際號碼與地址請查外交部領事事務局公告"
    },
    {
      "label": "境外主辦（示範國際組織）",
      "name": "大會秘書處聯絡人：林示範",
      "phone": "+66-81-555-6789",
      "note": "會議期間聯繫使用。緊急情況可 LINE / WhatsApp 聯繫同號碼。"
    },
    {
      "label": "國內緊急聯絡（承辦科）",
      "name": "綜合規劃司第二科",
      "phone": "+886-2-2356-0000 分機 1234",
      "note": "工作時間內聯繫；非辦公時間緊急事宜請聯絡值班電話。"
    }
  ],
  "notes": [
    "簽證與入境：請依護照類別、停留目的、轉機地及出發日期，查領事事務局與目的地官方的簽證、入境登錄及護照效期規定；本示範不提供免簽天數。",
    "時差：泰國時間（ICT，UTC+7）較台灣（UTC+8）慢 1 小時，返國後注意生理時鐘調整。",
    "旅費核銷：依「國外出差旅費報支要點」辦理，所有支出請保留正式收據；住宿費超標部分須自行負擔。",
    "行動通訊：建議出發前向電信業者申請國際漫遊或於機場購買當地 SIM 卡，以確保境外聯絡暢通。",
    "健康安全：請攜帶常備藥品；若有特殊醫療需求，出發前請告知承辦科並備妥英文醫療文件。",
    "機密文件管控：公務攜出文件依機密等級妥善保管，禁止在公共場所討論或使用未加密設備開啟機密檔案。"
  ],
  "flights": [
    {
      "leg_n": 1,
      "date": "2027-09-01",
      "route": "台北→曼谷",
      "departure_time": "09:45",
      "arrival_time": "12:15",
      "flight_no": "XX901",
      "source": "searched"
    },
    {
      "leg_n": 2,
      "date": "2027-09-05",
      "route": "曼谷→台北",
      "departure_time": "09:15",
      "arrival_time": "13:45",
      "flight_no": "XX902",
      "source": "searched"
    }
  ],
  "report_title": "示範年度業務協調會議出國報告",
  "report_content": {
    "purpose": [
      "本次合成行程用以展示資料填寫及報告產生方式。目的為交流跨部門資料互通作法，並蒐集各方對合作框架的意見。"
    ],
    "process": [
      "第一日抵達後進行會前整備；第二日參與資料互通標準與合作框架討論；第三日參與工作坊及雙邊會談；第四日安排資料中心參訪；第五日返國。本段為合成示範，實際使用須依會議紀錄補寫討論重點及結果。"
    ],
    "insights_and_recommendations": [
      "本段為合成示範：建議依實際觀察，逐項記錄可供機關研辦事項、權責單位及後續工作。請以真實材料替換後再送核。"
    ]
  }
}
